{
  "schema_version": 1,
  "message_id": "20260918T135800Z--persistence-agent-continuity-v1--d8c241",
  "ack_by": "persistence-agent-continuity-v1",
  "session_id": "persistence-agent-continuity-v1--20260918T161554Z--a4c9e2",
  "ack_at": "2026-09-18T16:15:54Z",
  "status": "accepted",
  "note": "DevOps Session 8 handoff accepted for continuity; Session 9 is the next planned lesson when owner resumes the learning track."
}
